{"action_id":"official-surface-e2e-20260804-repair-2","harness_bytes":434,"harness_sha256":"5bdc11733eb71a1176402aff7bd6f1be20067d899fb8cefe14f183a8828e5157","input_lock_sha256":"7bb584da29f1fb55e5f46133a985bd3c249f154643dad5a3469ae737aee497e7","payload":{"next_role":"model-server","request":{"max_tokens":4,"prompt":"NON-SCIENTIFIC ROLE HANDSHAKE; NO MODEL OR BENCHMARK","request_id":"official-surface-e2e-20260804-repair-2-request","temperature":0.0}},"record_kind":"cloud_production_role_receipt","request_id":"official-surface-e2e-20260804-repair-2-request","request_sha256":"1b3bfaa88684c6f5935085e7098c4bbf8beebdf260f257fceca2975e37c747dc","role":"controller","schema_version":"0.1.0","state":"DISPATCHED"}
