{"action_id":"official-surface-e2e-20260804-repair","harness_bytes":430,"harness_sha256":"9135371fd24ca6c03d4791a6c6962b763293be48a62c9099fa015d9435c8f58f","input_lock_sha256":"7bb584da29f1fb55e5f46133a985bd3c249f154643dad5a3469ae737aee497e7","payload":{"next_role":"benchmark-worker","response":{"adapter":"content-addressed-qualification-v1","text":"qualification:e0a676d7f19acb7b","token_ids":[224,166,118,215]},"response_sha256":"5fd8703f996cd99c6654235ea2a160d6c815f6f44f6a7e704e099a32fd16d8a5"},"record_kind":"cloud_production_role_receipt","request_id":"official-surface-e2e-20260804-repair-request","request_sha256":"61bd2e12894cad80c02725a8182d2e18cc67774e61fb41fa2032bec40effc729","role":"model-server","schema_version":"0.1.0","state":"RESPONDED"}
