{"action_id":"official-surface-e2e-20260805","harness_bytes":416,"harness_sha256":"2322c541c8e7b7f34466967c715d5b8f99582e4691f9e5e226c9363fa6cedbd6","input_lock_sha256":"7bb584da29f1fb55e5f46133a985bd3c249f154643dad5a3469ae737aee497e7","payload":{"next_role":"model-server","request":{"max_tokens":4,"prompt":"NON-SCIENTIFIC ROLE HANDSHAKE; NO MODEL OR BENCHMARK","request_id":"official-surface-e2e-20260805-request","temperature":0.0}},"record_kind":"cloud_production_role_receipt","request_id":"official-surface-e2e-20260805-request","request_sha256":"2d02665bf385958be02b939ced370eb777bbb246828fd47786854c954757be1c","role":"controller","schema_version":"0.1.0","state":"DISPATCHED"}
