{"action_id":"official-surface-e2e-20260804","harness_bytes":416,"harness_sha256":"c3d721dc80a328db40370710ba9ee06885e9dd5d4f55ec9aadf6b0e7e8ab6505","input_lock_sha256":"7bb584da29f1fb55e5f46133a985bd3c249f154643dad5a3469ae737aee497e7","payload":{"accepted":true,"evaluation":"protocol_round_trip","generated_tokens":4,"response_sha256":"5fd8703f996cd99c6654235ea2a160d6c815f6f44f6a7e704e099a32fd16d8a5"},"record_kind":"cloud_production_role_receipt","request_id":"official-surface-e2e-20260804-request","request_sha256":"769897e1bd13cb635a9e7b6fcae40ca0d618972ddae6fbcd97331890a3ddb319","role":"benchmark-worker","schema_version":"0.1.0","state":"COMPLETE"}
